{
  "schema_version": 1,
  "policy_id": "default_firstboot_review",
  "mode": "firstboot_release_gate",
  "authorization": {
    "authorized_defensive_use_only": true,
    "operator_acknowledgement_required": true,
    "remote_host_mutation_allowed": false
  },
  "freshness": {
    "enabled": true,
    "max_artifact_age_minutes": 1440,
    "future_clock_skew_tolerance_seconds": 300
  },
  "artifacts": [
    {
      "name": "firstboot_handoff_index_json",
      "path": "/var/log/host_vm_policy_firstboot_handoff.json",
      "required": true,
      "producer": "host_vm_policy_firstboot_handoff.py"
    },
    {
      "name": "firstboot_manifest_json",
      "path": "/var/log/host_vm_policy_firstboot_manifest.json",
      "required": true,
      "producer": "host_vm_policy_firstboot_manifest.py"
    },
    {
      "name": "policy_validator_evidence_json",
      "path": "/var/log/host_vm_policy_validator_evidence.json",
      "required": true,
      "producer": "host_vm_policy_validator.py"
    }
  ],
  "privacy_boundaries": {
    "aggregate_only": true,
    "forbidden_fields": [
      "raw_logs",
      "packets",
      "captures",
      "credentials",
      "hostnames",
      "usernames",
      "secrets",
      "model_binaries",
      "datasets",
      "private_keys",
      "tokens"
    ]
  },
  "rollback": {
    "revert_files_only": true,
    "live_state_rollback_required": false,
    "notes": "Revert only the checked-in example policy profile and evidence references; no live host, VM, firewall, service, IDS, credential, account, package, approval, or restore state is changed."
  }
}
